TV1,Bond,Harry Potter,Cheesy,Game
"I use coffee to wake up. And, now I'm up.","James Bond: ""Well, that depends on your definition of safe sex.""",,Hello. Cupid called. He says to tell you that he needs my heart back,my lodge is lonely without you.
I want to use my coupons for free hugs on you.,You come here often.,,"Here's $10. Drink until I am really good looking, then come and talk to me.",My mats is all wood for you.
I want you to be part of my life.,"You didn't think I'd miss this performance, did you?",,"Here's the key to my house, my car... and my heart",My towers tilt for you.
I was just listening to a crazy termite. Hatching a crazy plan that absolutely will not work.,"You don't think I enjoyed what we did this evening, do you? What I did tonight was for Queen and country!",,Hershey's makes millions of kisses a day.. .all I'm asking for is one from you.,No shockwave grenade is going to keeps you away from me.
I will help you avenge your father's death after you help me avenge this boner.,You look way prettier in person than through your webcam.,,"Hey baby you're so fine you make me stutter, wha-wha-what's your name?","Once I’m done with you, you’re gonna need to abortnite."
I wish I was a pokemon master so I could peek-at-chu (pikachu).,"You're a woman of many parts, Pussy!",,"Hey baby, I must be a light switch, because every time I see you, you turn me on!",The only solo win I desire is You.
I wish I was an ion so I could form an exothermic bond with you.,You're free Friday. Would you like to have dinner?,,"Hey baby, you've got something on your butt - my eyes!",Time to get some pump action.
I would wuv to get in your pants.,,,Hey baby. You got a jersey? [A jersey?...Why?] Because I need your name and number.,Wanna feel my shifty shaft? 
I'd do anything to protect my sister. Does that make you hot?,,,Hey how many boyfriends have you had? (Like 10 I Think) Could I Make That 11?,Want me to Grease up your Grove tonight? 
I'd like to hang out at your peach pit,,,"Hey, are you my appendix? Because I don't understand what you do, but this feeling in my stomach makes me want to take you out?",Want to check out my pickaxe?
I'd like to love you until un-death do us part.,,,"Hey, don't frown. You never know who could be falling in love with your smile.",Want to Fortnite and Chill?
I'd love to be the Diet Pepsi to your Sofia Vergara.,,,"Hey, don't I know you? Yeah, you're the girl with the beautiful smile.",Would You like to rocket ride me?
I'd love to dock my boat in your harbor.,,,"Hey, how did you do that? (What?) Look so good?",You are as fine as a gold scar.
I'd love to tune up your engine.,,,"Hey, I didn't know angels flew so low.",You are as rare as a purple RPG from a chest.
I'd never yada yada sex with you!,,,"Hey, I'm new in town.",You ever been sprayed by a mini gun?
I'll be in my bunk. Wanna come with?,,,"Hey, is it just me, or are we destined to be married?",You got a jump pad? Cause I’ll jump right over to you.
I'll follow you through a revolution and back.,,,"Hey... Didn't I see your name in the dictionary under ""Shazaam!""?",You have built into my heart.
I'll hack my way into your heart.,,,Hey... somebody farted. Let's get out of here.,You just won the battle royal to my heart.
I'll love you until Tom catches Jerry and has him 4 supper,,,"Hi, did your license get suspended for driving all these guys crazy?",You turned my pants into a Moisty Mire.
I'll slime you so good you'll think your on Nickelodeon,,,"Hi, I have big feet.",You won my heart.
"I'm a criminal, we keep odd hours.",,,"Hi, I'm a fashion photographer. Would you like to be in my next photo shoot?",You'll be wailing at my woods.
I'm a paleontologist. I dig.,,,"Hi, I'm Mr. Right--I heard you were looking for me.",Your chest is legendary.
I'm a real good sex person,,,"Hi, I'm writing a term paper on the finer things in life, and I was wondering if I could interview you?",Hey girl do you play Fortnite.
"I'm a spring princess, so consider yourself sprung!",,,"Hi, my name is Doug. That's ""god"" spelled backwards with a little bit of U wrapped up in it",I got a bazooka in my pants and it's legendary.
I'm a sucker for surveillance. Would you like to join me?,,,"Hi, the voices in my head told me to come over and talk to you.",I’ll be your duo queue tonight.
I'm a very private person. Care to be something I'll never tell a soul about?,,,"Hi. I'm an astronaut, and my next mission is to explore Uranus.",
I'm Chuck Bass.,,,How come you're not on top of a Christmas tree? I thought that's where angels belonged.,
I'm dating myself.,,,How does it feel to be the most beautiful girl in this place?,
"I'm digging your body, but what really turns me on are your brainssssss!",,,How is your fever? [What fever?] Oh... you just look hot to me.,
I'm Earl Kinsella and I have a lot to offer,,,How much does a polar beat weight? Enough to break the ice!,
I'm feeling some sapphic vibes coming off you.,,,How much? To buy your heart baby...,
"I'm giving you my cold face. Hardcore, right?",,,How was heaven when you left it?,
"I'm like a human USB, baby. I can do it all.",,,I am a man of few words. You are beautiful. Would you like to go out?,
I'm like a ship without a port!,,,I bet you $20 you're gonna turn me down.,
"I'm lyin' I'm dyin', you know what I'm sayin?",,,I blame you for global warming... your hotness is too much for the planet to handle!,
"I'm not a doctor, but I'd sure love to give you a physical exam.",,,I can hold my liquor but kissing you would make me weak at the knees.,
I'm not a gold digger. It's just your bank account turns me on.,,,"I can't believe I've been hear the entire evening with all these beautiful people and the moment I find 'The One', all I have time to say is ""good bye"".",
I'm not a stop along the way. I'm a destination.,,,I can't think of anyone else I'd rather survive a Zombie Apocalypse with.,
"I'm not Colombian, but I can tell you're caliente.",,,I could use some spare change and you're a dime.,
I'm not so good with the advice... Can I interest you in a sarcastic comment?,,,"I didn't believed in heaven, until I saw you.",
"I'm only a teacher from 8:15 to 3:00. After that, I'm just a person like anyone else.",,,I didn't know angels were allowed on campus.,
"I've got a ""book"" for you to red.",,,I didn't know that angels could fly so low!,
"I've got a fever, and the only prescription is more of what you've got, baby.",,,"I didn't see any stars in the sky tonight, the most heavenly body was standing right next to me.",
"If I get your number, can I call you sexy?",,,"I don't have a library card, but do you mind if I check you out?",
"If I told you you had a beautiful body, would you hold it against me? Get it? It's a double entendre... Savez-vous?",,,I don't know how I'll ever get to class on time when it's so easy to get lost in your eyes.,
"If I’m a demon, you must be a Devil’s Trap, because I’m stuck to you.",,,"I don't know if you're beautiful, I haven't gotten past your eyes yet.",
"If you think I'm crazy now, wait until we get in the sack.",,,"I don't know which is prettier today, the water, the sky or your eyes.",
"If you want to receive e-mails about my upcoming shows, then please give me money so I can buy a computer.",,,"I don't know you, but I think I love you already",
"If you're too good for 99 percent of guys, that's cool, because I'm a one-percenter.",,,I have an 'owie' on my lip. Will you kiss it and make it better?,
"In the morning, I'll let you wear my knitted cap.",,,"I have had a really bad day and it always makes me feel better to see a pretty girl smile. So, would you smile for me?",
Is Gabriel around? Because you’re like a beautiful mirage.,,,I hear they banned you from school lunches for being so sweet.,
Is that a Callahan full-bore auto-lock or are you just happy to see me?,,,"I hope there's a fire truck nearby, cause you're smokin'!",
Is that a stair car in your pants or are you happy to see me?,,,"I hope there's a fireman around, cause you're smokin'!",
"Is that rigor mortis setting in, or are you just happy to see me?",,,"I hope you know CPR, because you take my breath away!",
Is that the Colt in your pocket or are you just happy to see me?,,,I hope you like coffee...because I always have Folgers in my Cup,
Is your name Alec Hardison? it seems you know how to turn my software to hardware.,,,I hope your day has been as beautiful as you are.,
It is what it looks like - I was sent here to kill you.,,,"I just got dumped, and I think that you could make me feel better.",
It's not stalking if you both happen to be at the same party. (Spike),,,I just got this naughty list from Santa and I'm pretty sure you're on it.,
It’s beautiful here.,,,I just had to come talk with you. Sweetness is my weakness.,
I’d go to hell and back just to be with you.,,,I just wanted to show this rose how incredibly beautiful you are!,
I’d like to be your Mother of All,,,"I know I don't have a chance, but I just wanted to hear an angel speak.",
I’d love to jump in your hole.,,,I know I'm not a library book but I can tell when you're checking me out.,
I’m just admiring you. It’s impressive how you’ve handled everything.,,,"I know milk does a body good, but baby, how much have you been drinking?",
"I’m not a wraith, but I can make you go crazy with one touch.",,,"I know somebody who likes you but if I weren't so shy, I'd tell you who.",
Janice: Oh... my... God!,,,"I like Legos, you like Legos, why don't we build a relationship?",
"Joan, let's make a pact, OK? If we're both still single in an hour, let's get married.",,,"I love my bed, but I'd rather be in yours.",
"Joey: Come on, give me another chance. I can do a southern accent. [with Jamaican accent] Joey: Ya, mon.",,,I love you like a pig loves not being bacon.,
"Let play a game called T.V, I turn your knobs and you watch my antennae rise.",,,"I may not be a genie, but I can make your dreams come true.",
Let's commit the perfect crime: I'll steal you're heart and you'll steal mine.,,,"I may not be DQ, but I could treat you right.",
Let's get together and test the Big Bang Theory.,,,"I must be a snowflake, because I've fallen for you.",
Let's go break the law just one more time.,,,"I must be dancing with the devil, because you're hot as hell.",
"Let's go out to Oyster Bay, where no one will find us for a long, long time.",,,"I must be in a museum, because you truly are a work of art.",
Let's park and get some recreation going.,,,I must be in heaven because I'm looking at an angel!,
Let's role play tonight. You play me and I'll play you.,,,"I need a dollar, but I only have 90 cents... do you want to be my dime?",
Let's run away on that boat I stole from some white guy,,,I need more than 140 characters to tell you how beautiful you are.,
Let's take some revenge out on these sheets.,,,I need some answers for my math homework. Quick. What's your number?,
Let's work on our night cheese together,,,I never need to see the sun again because your eyes light up my world.,
Let’s get out of here and go all Chuck and Blair in the back of the limo.,,,"I play the field, and it looks like I just hit a home run with you.",
"Listen to me. This harvest festival, it's gonna knock your socks off and when it does, I'm gonna be there to give you a foot massage. To completion.",,,I seem to have lost my phone number. Can I have yours?,
"Look, if you knew me at all and shut me down, it would be one thing, but to be dismissed on a simple ""hello"", well, that's a tough pill to swallow.",,,I sneezed because God blessed me with you.,
Looking for your happy ending? Let me show you the way.,,,"I think I can die happy now, cause I've just seen a piece of heaven.",
"Love isn't blind, it's retarded.",,,I think it is time I tell you what people are saying behind your back. Nice Ass!,
Meat should never be used as an adjective.,,,I think there's something wrong with my eyes because I can't take them off you.,
My engine is overheating just standing near you.,,,I think you just stole something. [What?] My heart.,
My freedom is worth more than anything that diamond could buy.,,,I think you're suffering from a lack on vitamin me.,
My name's Nate Ford...and I am a thief.,,,I thought happiness started with an H. Why does mine start with U?,
My nephew was in twilight,,,I tried my best to not feel anything for you. Guess what? I failed.,
My sex doll is very popular in Japan,,,I tried to send you something sexy last night but the mail man told me to get out of the mailbox,
"Neal Caffrey, at your service.",,,I wanna live in your socks so I can be with you every step of the way,
No power in the 'Verse can stop me... in bed.,,,"I want our love to be like pi, irrational and never ending.",
"No sex for you! I mean..Yes, sex for you!",,,"I want to be your tear drop, so I could be born in your eyes, live on your cheeks, and die on your lips.",
No tea in this dress shop? What are you going to do?.. Put me in dress jail?,,,I want to tell you your fortune. [Take her hand and write your phone number on it.] Your future is clear.,
"No, I don’t text her, 'It was nice meeting you.' I wait eight weeks and I text her, ‘What's crackin?'",,,I want you almost as much as I want world peace.,
Of course I'm good in bed. How do you think Finch got his limp?,,,"I was feeling a little off today, but you definitely turned me on.",
"Oh there is plenty of fish in the sea, but only one bass.",,,I was so enchanted by your beauty that I ran into that wall over there. So I'm going to need your name and number for insurance purposes.,
"Once I bent down to pet a small dog and hey, it was a 5 pound squirrels.",,,I was wondering if you had an extra heart mine seems to have been stolen,
"One time in college, a girl told me it's not you, it's me. You're darn right it's you... you heifer!",,,I was wondering if you have a moment to spare for me to hit on you?,
Ouch! My tooth hurts..it's because you're so sweet.,,,"I wasnt sure if you were a beautiful angel or a sexy devil, but now that I'm close I see heaven in your eyes.",
"Plus, I don't have any early classes so we can sleep in",,,I will stop loving you when an apple grows from a mango tree on the 30th of February.,
"Revenge is a dish best served cold; my love on the other hand, is best served hot and steamy.",,,"I wish I was cross eyed, so I could see you twice.",
"Revenge might be a dish served cold, but I'll make sure the sex is piping hot.",,,"I won't give you a pick-up line, if you let me buy you a drink.",
Sex couldn't kill me.,,,I would die a million deaths if it meant I could be with you!,
Sitting next to borpoh doesn't come close to snitting next to yerpoh,,,I'd marry your cat just to get in the family.,
Sometimes bad guys are the only good guys you get.,,,"I'd offer you a cigarette, but you're already smoking hot.",
"Spike: You listen to me. [Kneels in front of her] I've been alive a bit longer than you, and dead a lot longer than that. I've seen things you couldn't imagine, and done things I prefer you didn't. I don't exactly have a reputation for being a thinker. I follow my blood, which doesn't exactly rush in the direction of my brain. So I make a lot of mistakes, a lot of wrong bloody calls. A hundred plus years, and there's only one thing I've ever been sure of: you.",,,"I'd say God Bless you, but it looks like he already did.",
Standing next to you makes me feel better about myself,,,I'd suck a fart out of your ass and hold it like a bong hit.,
"Ted Mosby, Architect",,,"I'll be Burger King and you be McDonald's. I'll have it my way, and you'll be lovin' it.",
That ass. Have Mercy.,,,I'll cook you dinner if you cook me breakfast.,
The story I tell our future kids about this moment will be legen- wait for it…,,,I'll show you my tan lines if you show me yours.,
There's a banana stand in my pants.,,,I'm drowning in the sun and need mouth to mouth now!,
"They call me the hero of canton, you know.",,,I'm fighting the urge to make you the happiest woman on earth tonight.,
They call me toofer because I'm both black and great in bed,,,I'm going outside to make out... care to join me?,
Think I'm in trouble?,,,"I'm going to need a tall glass of cold water, because baby your making me HOT!",
"This might sound crazy, but I just had a flash-forward to us falling in love and getting married.",,,I'm lactose intolerant so please keep your cheesy pick up lines away from me.,
This suit is for leisure. But many times I wear it to get down to business.,,,I'm learning about important dates in history. Wanna be one of them?,
"To another time, to another place, to another us.",,,"I'm Mr. Right, someone said you were looking for me?",
To blergh you is to love you,,,I'm new in town. Could you give me directions to your apartment?,
Two words: Companion training.,,,"I'm no mathematician, but I'm pretty good with numbers. Tell you what, Give me yours and watch what I can do with it.",
"Wade: What's going on here? Zoe: I am here, Wade, to seduce you. Wade: You know, most people don't announce it first. Zoe: I just wanted to make sure you were aware of what was happening because this, my friend, is happening.",,,I'm no organ donor but I'd be happy to give you my heart.,
Wanna get in? I'd love to give you a ride.,,,"I'm not a photographer, but I can picture me and you together",
Wanna get twixt my nethers?,,,I'm not actually this tall. I'm sitting on my wallet.,
Wanna make a huge mistake?,,,"I'm not drunk, I'm just intoxicated by you.",
We can sandwich toast to orgasms. - Red,,,I'm not staring at your boobs. I'm staring at your heart.,
What is it with women and shoes?,,,"I'm not trying to impress you or anything, but... I'm Batman!",
"Whatever it is that you servin, you better give me a double",,,"I'm sorry, I don't think we've met. I wouldn't forget a pretty face like that.",
Whatever your real name is I will love you.,,,"I'm sorry, were you talking to me? [No] Well then, would you like to?",
Who needs consent? I'm Chuck Bass.,,,"I'm writing a term paper on the finer things in life, and I was wondering if I could interview you.",
Why do you have to throw a wet blanket on my dreams?,,,"I've been wondering, do your lips taste as good as they look?",
Will you be my person?,,,"I've got skittles in my mouth, wanna taste the rainbow?",
Will you be my sex Yoda?,,,"I've gotta thirst, baby, and you smell like my Gatorade.",
Would you like to stroke my gun? Her name is vera.,,,I've had a really bad day but it always makes me feel better when I see a pretty girl smile. Would smile for me and make my day?,
"Yeah, that's a gun in my pants. But I'm also really happy to see you.",,,I've had such an off week but seeing you just turns me on.,
"Yes I am a hunter, and it's you season.",,,I've heard it's bad luck not to kiss someone at midnight. (New Year's Eve),
YOLO!,,,I've noticed you noticing me and I'm just giving you notice that I've noticed you!,
You all that and a bag of chips!,,,I’m single and desolate. Can you help me?,
You can call me Sophie Devereaux. Because I'm the greatest actress.. when I am stealing your heart.,,,I’ve only got three months to live.,
"You can't tell me your opinion doesn't matter. You changed me for the better in a hundred different ways. Yeah, I might miss a book or a, a salad here and there, but...I've got Claire all over me.",,,"If a fat man puts you in a bag at night, don't worry I told Santa I wanted you for Christmas.",
You checkin’ out my guns?,,,"If a thousand painters worked for a thousand years, they could not create a work of art as beautiful as you",
You don’t need a spell to summon me.,,,"If beauty were time, you'd be eternity",
You f***ing tickle me. - Nicky,,,"If God made anything more beautiful than you, I'm sure he'd keep it for himself.",
You have a tell.,,,"If I could reach out and hold a star for every time you've made me smile, I'd hold the sky in the palm of my hand.",
You have heartbreak and I have hostility. Let's take the day off and play hooky,,,"If I could rearrange the alphabet, I would put 'U' and 'I' together.",
You know from the moment I met you I knew You were a man of fine taste.,,,"If I followed you home, would you keep me?",
You make me feel like I'm high-fiving a million angels,,,"If I freeze, it's not a computer virus. I was just stunned by your beauty.",
"You might not know it to look at me, but I can run really, really fast.",,,"If I get hooked on you, will you hook up with me?",
You must be a hell of a thief because you stole my heart from across the room.,,,If I had a garden I'd put your two lips and my two lips together.,
"You must be Pestilence, ‘cause you’ve infected me.",,,"If I had a penny for every time I thought of you, I'd have exactly one cent, because you never leave my mind.",
You must be the Impala because I’d love to ride you all night.,,,"If I had a rose for every time I thought of you, I would be walking through my garden forever.",
"You must be the yellow-eyed demon, because you’re my obsession.",,,"If I had a star for every time you brightened my day, I'd have a galaxy in my hand.",
"You waited too long and now you're in ""The Friend Zone"".",,,"if I had to choose between breathing or loving you, I would say ""I love you"" with my last breath!",
You will enjoy my special tea ceremony.,,,If I had to choose between one night with you or winning the lottery...I would chose winning the lottery...but it would be close...real close...,
"You'd better be a cardiologist, because something about you makes me want to give you my heart.",,,If I had to rate you out of 10 I'd rate you a 9... because I am the one that you are missing!,
You're like the girl of my dreams and the girl I made on my computer all in one.,,,"If I received a nickel for every time I saw someone as beautiful as you, I'd have five cents.",
You're my Angel.,,,"If I told you that you had a beautiful body, would you hold it against me?",
You're shiny.,,,"If I told you that you had a great body, would you hold it against me?",
You're so amazing baby. Are you sure it's the queen that stole my heart?,,,If i was cosin squared and you were sin squared we would be one.,
You're sweeter than an ice planet.,,,If I were a cat I'd spend all 9 lives with you.,
Your ass haunts me. - Caputo,,,"If I were a stop light, I'd turn red every time you passed by, just so I could stare at you a bit longer.",
your love makes me feel like my hearts trying to hug my brain,,,"If I were a transplant surgeon, I'd give you my heart.",
Your name must be Eliot. You had me at Hello.,,,"If I were to ask you out on a date, would your answer be the same as the answer to this question?",
Your world won't be easier if I did not come back.,,,"If I were writing an essay on your beauty, I wouldn't need to double-space or increase the margin sizes to satisfy the minimum page requirement.",
You’re hotter than a ceiling fire.,,,"If it weren't for that DAMNED sun, you'd be the hottest thing ever created.",
You’re on a clock. The question is who’s clock are you on?,,,"If kisses were snowflakes, I'd send you a blizzard",
,,,If LOVE was written on every grain of sand in the Sahara Desert that still doesn't equal my love for you.,
,,,"If nothing lasts forever, will you be my nothing?",
,,,"If stars would fall every time I would think of you, the sky would soon be empty.",
,,,"If this bar is a meat market, you must be the prime rib.",
,,,"if we shared a garden, I'd put my tulips and your tulips together. (tulips = two lips)",
,,,"If we’re going to have sex later, you probably should be there.",
,,,"If women were trophies, you'd be first place!",
,,,If you could put a price tag on beauty you'd be worth more than Fort Knox.,
,,,"If you stood in front of a mirror and held up 11 roses, you would see 12 of the most beautiful things in the world.",
,,,If you were a booger I would pick you first.,
,,,If you were a booger I'd pick you first.,
,,,"If you were a chicken, you'd be impeccable.",
,,,If you were a laser you would be set on stunning.,
,,,"If you were a library book, I would check you out.",
,,,"If you were a new hamburger at McDonald's, you would be a McGorgeous.",
,,,"If you were a potato, you'd be a sweet one.",
,,,If you were a steak you would be well done.,
,,,If you were a tear in my eye I would not cry for fear of losing you.,
,,,"If you were a transformer, you'd be a HOT-obot, and your name would be Optimus Fine",
,,,"If you were a tropical fruit, you'd be a Fine-apple!",
,,,If you were a vegetable you'd be a cute-cumber.,
,,,"If you were ground coffee, you'd be Espresso cause you're so fine.",
,,,If you weren't here I'd be the hottest person in this place.,
,,,"If you're advertising, I'm buying!",
,,,"If your heart was a prison, I would like to be sentenced for life.",
,,,"If your left leg is Thanksgiving, and your right leg is Christmas, can I visit you between the holidays?",
,,,Inheriting 10 million dollars doesn't mean much when you have a weak heart,
,,,Inheriting eighty million bucks doesn't mean much when you have a weak heart.,
,,,"Is it bright out here, or is that just your halo?",
,,,Is it hot in here or is it just you?,
,,,Is there a rainbow today? I just found the treasure I've been searching for!,
,,,"Is there a science room nearby, or am I just sensing the chemistry between us?",
,,,Is there an airport nearby or is that just my heart taking off?,
,,,Is your body from McDonald's? Because I'm lovin' it!,
,,,Is your father a Baker? Because you've got some nice buns!,
,,,Is your father a drug dealer? Because you're so Dope!,
,,,Is your father a jewel thief? because you're a real gem.,
,,,Is your father a terrorist? Because you are the bomb.,
,,,Is your father an art thief? Because you're a masterpiece.,
