TV1,Bond,Harry Potter,Cheesy,Game
,,,Is your father Little Caesar? Because you look Hot 'n Ready.,
,,,"Is your last name Campbell? Because you're ""mmmm... good!""",
,,,Is your last name Campbell? Because you're mm mm good!,
,,,Is your last name Gillette? Because you are the best a man can get.,
,,,"Is your last name Whitman, because I want to sample you.",
,,,Is your name 'Swiffer'? 'Because you just swept me off my feet.,
,,,"Is your name Katrina? [No, why?] 'Cuz baby, you rock me like a hurricane!",
,,,Is your name mickey? because your so FINE!,
,,,Is your name Summer? 'Because you are as hot as hell.,
,,,"It's a good thing I wore my gloves today; otherwise, you'd be too hot to handle.",
,,,It's a good thing that I have my library card. Why? Because I am totally checking you out!!,
,,,It's dark in here. Wait! It's because all of the light is shining on you.,
,,,"It's not my fault that I fell for you, you tripped me!",
,,,"Kiss me if I'm wrong, but dinosaurs still exist, right?",
,,,Kissing burns 5 calories a minute. How about a workout?,
,,,"Kissing is a language of love, so how about a conversation?",
,,,Know what's on the menu? Me-n-u.,
,,,Lemme borrow that number gurl.,
,,,"Let me tie your shoes, cause I dont want you falling for anyone else.",
,,,"Let's commit the perfect crime: I'll steal your heart, and you'll steal mine.",
,,,Let's have breakfast together tomorrow; shall I call you or nudge you?,
,,,Let's make like a fabric softener and snuggle!,
,,,Let's play Winnie the Pooh and get my nose stuck in your honey jar.,
,,,"Lets play carpenter. First we get hammered, then I'll nail you!",
,,,Life without you would be like a broken pencil... pointless.,
,,,"Looks like you dropped something , My jaw!",
,,,"Me without you is like a nerd without braces, A shoe without laces, aSentenceWithoutSpaces",
,,,Most guys need 3 meals a day to keep going... I just need eye contact from you.,
,,,"Most people like to watch the Olympics, because they only happen once every 4 years, but I'd rather talk to you cause the chance of meeting someone so special only happens once in a lifetime.",
,,,My buddies bet me that I wouldn't be able to start a conversation with the most beautiful girl in the bar. Wanna buy some drinks with their money?,
,,,My doctor says I'm lacking Vitamin U.,
,,,"My friend thinks you're kinda cute, but I don't... I think you're absolutely gorgeous!",
,,,My lenses turn dark in the sunshine of your love.,
,,,My lips are like skittles. Wanna taste the rainbow?,
,,,"My love for you is like diarrhea, I just can't hold it in.",
,,,My name is [your here] but you can call me tonight!,
,,,"My name isn't Elmo, but you can tickle me any time you want to!",
,,,"Nice to meet you, I'm (your name) and you are...gorgeous!",
,,,"No wonder the sky is grey today, all the blue is in your eyes",
,,,"Of all the beautiful curves on your body, your smile is my favorite.",
,,,"Oh no, I'm choking! I need mouth to mouth, quick!",
,,,"On a scale of 1 to 10, you're a 9. I'm the 1 you need.",
,,,"On a scale of one to America, how free are you tonight?",
,,,Ouch! My tooth hurts! [Why?] Because you are soooo sweet!,
,,,Our break-up is worse than traffic in NY. I cant move-on!,
,,,"People call me John, but you can call me Tonight!",
,,,Pinch me. [Why?] You're so fine I must be dreaming.,
,,,Pointing at a spot on a girls face and say; You got a little beautiful on your face.,
,,,Put down that cupcake... you're sweet enough already.,
,,,"Rejection can lead to emotional stress for both parties involved and emotional stress can lead to physical complications such as headaches, ulcers, cancerous tumors, and even death! So for my health and yours, JUST SAY YES!",
,,,"Roses are red, bananas are yellow, wanna go out with a nice little fellow?",
,,,Santa's lap isn't the only place wishes come true.,
,,,"Say ""I bet I can kiss you on the lips without touching you."" and kiss her, then tell her you lost the bet.",
,,,See my friend over there? He wants to know if you think I'm cute.,
,,,See these keys? I wish I had the one to your heart.,
,,,Shall we talk or continue flirting from a distance?,
,,,"She/He says: ""Hold on""",
,,,"Should I smile because we are friends, or cry because I know that is what we will ever be?",
,,,Smile if you want to sleep with me.,
,,,"Smoking is hazardous to your health... and baby, you're killing me!",
,,,"So there you are! I've been looking all over for you, the woman of my dreams",
,,,"So, do you have a new years resolution, I'm looking at mine right now.",
,,,"So, what do you do for a living besides always making all the men excited and warm all over?",
,,,"Somebody better call God, cause heaven's missing an angel",
,,,"Somebody call the cops, because it's got to be illegal to look that good!",
,,,"Somebody needs to call the bomb squad, because you're the bomb!",
,,,"Someone should call the police, because you just stole my heart!",
,,,"Sorry, but you owe me a drink. [Why?] Because when I looked at you, I dropped mine.",
,,,Stand still so I can pick you up!,
,,,"Stare at girl . (""What're you staring at?"")",
,,,"Stop, drop, and roll, baby. You are on fire.",
,,,"Summer's over, because you're about to fall for me.",
,,,That dress would look great on my bedroom floor!,
,,,The only thing your eyes haven't told me is your name.,
,,,"There are 20 angels in the world 11 are playing, 8 are sleeping and 1 of them is standing in front of me.",
,,,There are 206 bones in the human body... do you want another one?,
,,,"There are people who say Disneyland is the happiest place on earth. Apparently, none of them have ever been in your arms.",
,,,There is something wrong with my cell phone. It doesn't have your number in it,
,,,There isn't a word in the dictionary for how good you look.,
,,,There isn't a word in the dictionary to describe how beautiful you are.,
,,,"There must be a light switch on my forehead because every time I see you, you turn me on!",
,,,"There must be something wrong with my eyes, I can't take them off you.",
,,,There's a big sale in my bedroom right now. Clothes are now 100% off!,
,,,"There's only one thing I want to change about you, and that's your last name.",
,,,There's a party in my pants and your invited.,
,,,They say dating is a numbers game... so can I get your number?,
,,,"They say milk does a body good, but you're living proof!",
,,,They say not to judge a book by it's cover but I don't even know you and I'm checking you out.,
,,,"This isn't a beer belly, It's a fuel tank for a love machine.",
,,,This time next year let’s be laughing together.,
,,,Too cheesy for you? Try these dirty lines,
,,,"Vogue just called, they want to put you on the cover.",
,,,"Wanna get some coffee, Because I like you a Latte",
,,,Wanna play Words With Friends With Benefits?,
,,,Wanna ring in the new year with a bang?,
,,,Want to be different? Say yes.,
,,,Want to come see my HARD DRIVE? I promise it isn't 3.5 inches and it ain't floppy.,
,,,Was that an earthquake or did you just rock my world?,
,,,Was you father an alien? Because there's nothing else like you on Earth!,
,,,Was your father a baker? Because you've got a nice set of buns.,
,,,Was your father a boxer? Because you're a knockout!,
,,,Was your father a mechanic? Then how did you get such a finely tuned body?,
,,,Was your father a thief? 'Because someone stole the stars from the sky and put them in your eyes.,
,,,Was your father an alien? Because there's nothing else like you on earth!,
,,,Was your father in the Air Force? Because you're da bomb.,
,,,Was your father king? He must have been to make a princess like you.,
,,,"We're like Little Caesar's, we're Hot and Ready.",
,,,"Well, here I am. What were your other two wishes?",
,,,"Well, I AM telepathic, and I can tell that you love me. Right? [NO!] Darn, I always get ""love"" and ""lust"" mixed up.",
,,,Were do you hide your wings?,
,,,Were you arrested earlier? It's gotta be illegal to look that good.,
,,,Were you in Boy Scouts? Because you sure have tied my heart in a knot.,
,,,"Were your parents Greek Gods, 'cause it takes two gods to make a goddess.",
,,,What are you doing for the rest of your life? Because I want to spend it with you.,
,,,What do you and the weather have in common? You're both Hot!,
,,,What do you want for Christmas? A date with you!,
,,,What does it feel like to be the most beautiful girl in this room?,
,,,What has 148 teeth and holds back the incredible hulk? My Zipper!,
,,,What is your favorite color? [Color] Mine too!,
,,,What size shoe you wear baby girl? I'm gonna guess size sexy!,
,,,What time do you have to be back in heaven?,
,,,What's a nice girl like you doing in a place like this?,
,,,What's on the menu? Me-n-U,
,,,"What's that on your face? Oh, must just be beauty. Here, let me get it off. Hey, it's not coming off!",
,,,"When God made you, he was showing off",
,,,"When I first saw you I looked for a signature, because every masterpiece has one.",
,,,"When I first saw you, I knew we could win the Stanley Cup in tonsil hockey.",
,,,"When I look into your eyes, it is like a gateway into the world of which I want to be a part.",
,,,"When I'm older, I'll look back at all of my crowning memories, and I'll think of the day my children were born, the day I got married, and the day that I met you.",
,,,"Whenever I think of the finer things in life, I think of exotic cars, fine wine and you.",
,,,Why don't you surprise your roommate and not come home tonight?,
,,,Would you grab my arm so I can tell my friends I've been touched by an angel?,
,,,"Would you sleep with a stranger? [No] Then Hi, my name is...",
,,,Would you touch me so I can tell my friends I've been touched by an angel?,
,,,Wouldn't we look cute on a wedding cake together?,
,,,Wow! Are those real?,
,,,"Yes, that's a iPhone in my pocket, but I'm also glad to see you.",
,,,You are a 9 - you'd be a perfect 10 if you were with me.,
,,,You are like a candy bar: half sweet and half nuts.,
,,,You are so beautiful that I would marry your brother just to get into your family.,
,,,You are so beautiful that you give the sun a reason to shine.,
,,,"You are so fine, I wish I could plant you and grow a whole field of you!",
,,,You are so sweet you could put Hershey's out of business.,
,,,You are the reason men fall in love.,
,,,You are the reason Santa even has a naughty list.,
,,,You are what I want for Christmas.,
,,,You Auto-Complete me.,
,,,"You be the Dairy Queen and I'll be your Burger King: You treat me right, and I'll do it your way.",
,,,"You better call Life Alert, because I've fallen for you and I can't get up.",
,,,You don't need keys to drive me crazy.,
,,,You hear that? The ocean wants you to join me for a drink.,
,,,You know how they say skin is the largest organ? Not in my case.,
,,,"You know I'd like to invite you over, but I'm afraid you're so hot that you'll skyrocket my air-conditioning bill",
,,,"You know the more I drink, the prettier you get!",
,,,You know what material this is? [Grab your shirt] Boyfriend material.,
,,,You know you're in love when you can't fall asleep because reality is finally better than your dreams.,
,,,"You know, beautiful is my favorite color. (girl) that's not a color.(boy) its the color of your eyes.",
,,,"You know, Dr. Phil says I'm afraid of commitment...Want to help prove him wrong?",
,,,"You know, I would die happy if I saw you naked just once!",
,,,"You know, it'd be a lot easier for me to sweep you off your feet if you stood up.",
,,,"You know, you might be asked to leave soon. You are making the other women look bad.",
,,,"You look beautiful today, just like every other day.",
,,,You look cold. Want to use me as a blanket?,
,,,You look familiar.,
,,,"You look like a cool glass of refreshing water, and I am the thirstiest man in the world.",
,,,You look like my third wife. [how many time have you been married?] Twice.,
,,,You look like Pamela Anderson’s sister.,
,,,You look so familiar… didn't we take a class together? I could've sworn we had chemistry.,
,,,You make me melt like hot fudge on a sundae.,
,,,You make me wish I weren't gay!,
,,,You make my software turn to hardware!,
,,,"You may be asked to leave soon, you're making all the other women look bad.",
,,,"You may fall from the sky, you may fall from a tree, but the best way to fall... is in love with me.",
,,,You must be a hell of a thief because you stole my heart from across the room.,
,,,"You must be a high test score, because I want to take you home and show you to my mother.",
,,,"You must be a ninja, because you snuck into my heart",
,,,"You must be from Pearl Harbor, because baby, you're the bomb.",
,,,"You must be Jamaican, because Jamaican me crazy",
,,,You really shouldn't wear makeup. You're messing with perfection!,
,,,"You remind me of a magnet, because you sure are attracting me over here!",
,,,"You Say: ""Sorry, I can't hold on... I've already fallen for you.""",
,,,You see my friend over there? [Point to friend] He wants to know if YOU think I'M cute.,
,,,You see my friend over there? He wants to know if you think I'm cute,
,,,You should be someone's wife.,
,,,"You should go in the water, because you're so hot you're on fire!",
,,,You shouldn't wear makeup. It's messing with perfection,
,,,"You spend so much time in my mind, I should charge you rent.",
,,,You wanna know what's beautiful? Read the first word again.,
,,,"You, Before I Wake Up From this Dream.",
,,,"You'd better direct that beauty somewhere else, you'll set the carpet on fire.",
,,,You're 'No Parking' right? Just trying to guess your sign.,
,,,You're hotter than donut grease.,
,,,You're hotter than Papa Bear's porridge.,
,,,"You're kinda, sorta, basically, pretty much always on my mind.",
,,,"You're like a dictionary, you add meaning to my life!",
,,,You're like a prize winning fish. I dont know whether to eat you or mount you.,
,,,"You're like pizza. Even when you are bad, you're good",
,,,You're single. I'm single. Coincidence? I think not.,
,,,You're so beautiful that you made me forget my pickup line,
,,,You're so hot you must've started global warming.,
,,,You're so hot you would make the devil sweat.,
,,,You're so hot you would make the devil sweat.,
,,,"You're so hot, I bet you could light a candle at 10 paces.",
,,,"You're so hot, I could bake cookies on you.",
,,,"You're so hot, that if you ate a piece of bread, you'd poop out toast!",
,,,"You're so hot, you'd make the devil sweat",
,,,You're so hot; you make the sun envious.,
,,,"You're so sweet, you're giving me a toothache.",
,,,"You're the only girl I love now... but in ten years, I'll love another girl. She'll call you 'Mommy.'",
,,,You’re so beautiful; your birthday should be a national holiday.,
,,,Your ass is so nice that it is a shame that you have to sit on it.,
,,,Your body is 65% water and I'm thirsty.,
,,,Your eyes are as blue as window cleaner.,
,,,"Your eyes are blue, like the ocean. And baby, I'm lost at sea.",
,,,"Your eyes are bluer than the Atlantic ocean, and baby I'm lost at sea!",
,,,"Your eyes are like a sunset, They're Beautiful, inspiring, and hard to turn away from.",
,,,"Your father must have been a baker, because you've got a nice set of buns",
,,,Your father must have been a thief. Because he stole the stars from the sky and put them in your eyes.,
,,,Your hand looks heavy. Let me hold it for you,
,,,Your legs must be tired because you've been running through my mind all night,
,,,Your lips look so lonely.... Would they like to meet mine?,
,,,Your name must be Lucky Charms because you’re magically delicious!,
,,,"Your smile lit up the room, so I just had to come over.",
