TV1,Bond,Harry Potter,Cheesy,Game
Are you single? Because I'd love to start a non-nuclear family with you.,"James Bond: ""I was wrong about you.""",Together we could really make the 'Shrieking Shack' worthy of its name.,Can I buy you a drink or do you just want the money?,Lets make like the pages of this guide book and get under the covers.
"Baby we must be a perfect match, because you are in all my plans.","Dr. Christmas Jones: ""Yeah, how so?""",Wanna explore my chamber of secrets?,Can I copy your dance moves?,"Like an Umbreon, I also evolve at night."
"Baby, I love you so much that if Joss Whedon were writing our romance, one of us would be dead by now.","James Bond: ""I thought Christmas only comes once a year.""","Wanna make me moan like Myrtle? .,",Can I follow you home? Because my parents always told me to follow my dreams.,Looking at your ass makes my bulba soar.
"Baby, let me hack your pentagon.","James Bond: ""I'll tell you at dinner.""",Want to learn to speak troll? Don't worry I can get you grunting in no time.,Can I have directions? [To where?] To your heart.,My Bulbasaur knows TICKLE.
"Boo-boo bear. It's one of several nicknames I've made up for you. And you can choose which one you like best, 'cause I want this to be a give and take. ...We have cookie tush, Winnie the Boo, lady presh-presh, Annberry sauce, Annie get your boo, Tommy's girl, Annie bananie…","Jill Masterson: ""Where?""","We may not be in professor flitwick's class, but you sure are charming!",Can I have your picture so I can show Santa what I want for Christmas?,My Diglett's attracted to your SWEET SCENT.
Browncoats do it better.,"James Bond: ""Oh, I know the best place in town.""",Whaddya say you and me go look for the Room of Requirement?,Can I take your picture to prove to all my friends that angels do exist?,My Donphan won't ROLLOUT for you much longer.
"C'mon man, just take 'em off, just take 'em off and we'll have some fun.","James Bond: ""I'm still not quite sure how good you are.""",Without you I feel like I'm in Azkaban and dementors are sucking away my soul.,Can I tie your shoe? Because I can't have you fall for anyone else.,My Exeggcute are pretty weak. Let's battle so they can get some experience.
Can I be any more interested?,"Jinx: ""I am so good.""",Would you like to whomp my willow?,Can you kiss me on the cheek so I can at least say a cute girl kissed me tonight?,My Gyarados is BIG enough for you to ride it ALL day and night.
Can I go golfing with you?,"James Bond: ""Especially when you're bad.""","Wow, when I said ""Accio hottie"", I didn't expect it to work!",Can you pull this heart-shaped arrow out of my butt? A damn little kid with wings shot me.,"My Kadabra just used Future Sight, and it looks like we've got a future together."
Can I show you my Long Island?,"James Bond: ""Well, my dear, I take it you spend quite a lot of time in the saddle.""","Yeah, girls call me Aguamenti? Every time they hear my name they get wet.","Can you take me to the bakery? Because, I want a Cutiepie like you!",My Lickitung can reach deeper than you can imagine!
Can you empty your pocket? I believe you have stolen my heart.,"Jenny Flex: ""Yes, I love an early morning ride.""",You are like a bottle of Skele-Gro: You're growing me a bone.,Can you take me to the doctor? Because I just broke my leg falling for you.,My love for you burns like a Charizard's tail.
Care to dance?,"James Bond: ""Well, I'm an early riser myself.""",You can have the portkey to my heart.,"Come live in my heart, and pay no rent.",My Magikarp knows a little more than SPLASH if you know what I mean.
Carlton,"James Bond: ""Well, Tracy, next time play it safe and stand on five.""","You don't even have to say ""Luminos Maxima"" to turn me on!",Could you please step away from the bar? You're melting all the ice!,My Pokeballs are SWIFT in your mouth.
"Charlie: Whatever. What are you doing for dinner? Lisa: Charlie, a lot has changed. Charlie: I know. I'm older and wiser, and you're hot and on the rebound!","Tracy: ""People who want to stay alive play it safe.""","You don't need to say ""Incendio"" to light my fire",Crap. Something is wrong with my cell phone. {Oh Really. What is that?} Its just that...your numbers not in it.,My Shellder wants to clamp onto your Slowpoke's tail!
Check out my sweet buns,"James Bond: ""Please, stay alive! At least for tonight.""","You have two choices tonight, come with me and you'll see love spells. Go with him and you'll see Hog-WARTS!","Damn girl, I thought diamonds were pretty until I laid my eyes on you!",My Typhlosion knows Eruption.
Curse your sudden but inevitable betrayal in bed.,"James Bond: “Now put your clothes back on, and I'll buy you an ice cream.”",You make my Huffle puff.,"Damn girl, if you were a fruit, you'd be a FINEapple!",My Typhlosion knows EXPLOSION!!
"Darling, you're on fire. Like doughnut grease.","James Bond: [After Dr. Holly Goodhead kisses him] ""What was that for?""","You must be magical, because I've fallen under your spell.","Damn girl, you have more curves than a race track",Squirtle isn't the ONLY one that can use water gun. - wink -
Did you see that wonderful new documentary about the best sushi in the world?,"Dr. Holly Goodhead: ""For saving my life.""","You must be my horcrux, because you complete me.","Damn girl, your legs go all the way up and make and ass of themselves!",starMiE and starYU belong together do you get the message?
Do you know the first position?,"James Bond: ""Remind me to do it more often!""",You must be really good at Transfiguration! (Why?) Because you've changed my life.,"Damn, if being sexy was a crime, you'd be guilty as charged!","STD’s are like Pokemon baby, gotta catch ‘em all! Wanna help me out?"
Do you want some of my hot dog?,James Bond: [in bed with Christmas Jones] I was wrong about you.,"You must have given me some Skelegrow, 'cause my bone is really growing right now.",Damn! You with those curves and me without brakes!,"The name's cock..i mean brock..wait, i said that right."
Does anybody ever ask me how my day is going?,"Dr. Christmas Jones: Yeah, how so?","You're so hot, Aguamenti couldn't put you out!",Did god take the thunder out the sky and put it in your thighs?!,Those are some nice HOOTHOOTS you got there.
Don't leave. Everybody leaves.,James Bond: I thought Christmas only comes once a year.,Your kiss is like a dementor's........It takes my soul away!,Did it hurt? (Did what hurt?) When you fell out of heaven?,Wanna watch my EKANS evolve?
Emotion is a con man’s sweet spot.,"James Bond: [in the shower together] ""I like you better without your Beretta.""","Your name must be Severus Severus, because you're making my prince full blood.",Did the sun come out or did you just smile at me?,Want my Caterpie to use String Shot on you?
Excuse me! Are there any strippers here? Former strippers? Non-dancers but you're feeling a little bit drunk?,"Sévérine: ""I feel naked without it.""",Your smile's like expelliarmus: simple but disarming.,Did you clean your pants with Windex? I can practically see myself in them.,Want to Link your cable onto me?
Flute-playing enhances my finger dexterity,James Bond: I tend to notice little things like that - whether a girl is a blonde or a brunette...,,"Did you fart, cause you blew me away.",Want to register your number in my PokeNav?
"Ginger, U are fabulous! I’m an A-list actor you mite like to meet….Ure fone is dead and out of service…",Tiffany Case: And which do you prefer?,,Did you get your license suspended for driving so many guys crazy?,Want to ride my emPOLEon?
Girl your eyes are bluer than Heisenberg's Crystal,"James Bond: Well, as long as the collars and cuffs match.",,"Did you go to bed early last night? From the looks of it, you got your beauty sleep.",What's your favorite move? Mine is LICK.
"Girl, I got to tell you, that suit looks like a piece of 'Good God' wrapped up in some 'Have Mercy,' with a side of 'unghm!'",James Bond: Who are you?,,Did you have lucky charms for breakfast? Because you look magically delicious!,"When I look at you, my Metapod can't get any harder."
"Girl, you're more precious than Precious.",Pussy Galore: My name is Pussy Galore.,,"Did you hear that? Was that canon fire? Oh no, it's just my heart pounding!","When I'm around you, I am like a Geodude, as hard as a rock!"
Go home! Go home! Go home! With me.,James Bond: I must be dreaming,,Did you invent the airplane? Because you seem Wright for me,Why don't you and me go back to my gym and have a naked battle.
Going out with you would be my biggest break since the rural juror,"James Bond: You don't think I enjoyed what we did this evening, do you? What I did tonight was for King and country! You don't think it gave me any pleasure, do you?",,Did you just come out of the oven? Because you're hot.,Will you use ROCK POLISH on my Pokeballs?
Haaave you met me?,"Fiona Volpe: But of course, I forgot your ego, Mr. Bond. James Bond, who only has to make love to a woman and she starts to hear heavenly choirs singing. She repents and immediately turns to the side of right and virtue, but not this one. What a blow it must have been, you having a failure.",,Did you read Dr. Seuss as a kid? Because green eggs and... damn!,You give my Gengar that smile.
Have you ever licked the Liberty Bell?,"James Bond: Well, you can't win them all.",,Did you sit in a pile of sugar? Because you have a pretty sweet ass,You just gave me a Cubone.
Haven't you heard? I'm the crazy bitch around here.,James Bond: You're not my type.,,Did your father have sex with a carrot? Because you've got nice eyes.,You make me errupt like the Cinnabar Island volcano.
Hehe. You give me like...a boner or something. Yeah. Hehe. A boner.,"Girl: Why, cause I have half a brain?",,Didn't I see you on the cover of Vogue?,"You make me feel like an Electrode, you give me an EXPLOSION in my pants."
Hello. I'm a babe magnet.,"James Bond: No, cause you're single.",,Do I know you? Because you look a lot like my next girlfriend.,You make me RY-HORNY!
"Here is a good news. If I realize I'm insane, then I'm okay with it. I'm not dangerous insane.",James Bond:[in bed with his Scandinavian language tutor] I always enjoyed learning a new tongue.,,Do you believe in love at first sight or should I walk by again?,You make my bulba sore.
"Hey baby, wanna twirl with me?",Just relax while we unzip your files.,,Do you bleach your teeth? 'Because your smile lights up the entire room like a candle in the dark. Let's go prove it.,You make my Darkrai rise.
"Hey baby, you look so good, I wish I could plant you and grow a whole field of y'all!",Just relax while we unzip your files.,,Do you have a Band-Aid? Because I just scraped my knee falling for you.,You make my Gyrados HYDROPUMP!
Hey girl!! Why don't you stand up and wrap your arms around a REAL man? Ok checkitout checkitout checkitout. I got 4 words for you... Hol-i-day. inn. C'mon girl you know you want to!,"Log cabin girl: ""Oh James, I cannot find the words.""",,Do you have a keg in your pants? Because I'd like to tap that!,"You might need to catch them all, but all I need to catch is you."
"Hey girl, I don't have power and success, but I'm funny.","Bond: ""Well, let me try and enlarge your vocabulary.""",,Do you have a map? Because I just keep getting lost in your eyes!,You must be a Charmander because you're getting me hot.
"Hey girl, let's go to the deer blind.","Major Anya Amasova: ""That it's very important to have a positive mental attitude.""",,Do you have a mirror in your pocket? 'Because I could see myself in your pants.,"You put the ""BONE"" in Cubone."
"Hey girl, no need to hunt, you already trapped my heart.","James Bond: ""Nothing more practical than that?""",,Do you have a name or can I call you mine?,"You put the ""cool"" in Tentacool."
"Hey girl, you look so good, I'd marry you brother just to get in your family","Major Anya Amasova: ""Food is also very important.""",,Do you have a pencil? Because I want to erase your past and write our future.,"You put the ""Double-D"" in Dodou."
Hey Wadester.,"James Bond: ""Mm hmm. What else?""",,"Do you have a sunburn, or are you always this hot?","You put the ""Wiggle"" in Wigglytuff."
Hey! I'm so dope. I'm illegal in 55 states!,"Major Anya Amasova: ""When necessary, shared bodily warmth.""",,Do you have a twin sister? Then you must be the most beautiful girl in the world!,"You remind me of Deoxys, you're out of this world."
"Hey, boo. Are you aging in reverse? 'Cause you look barely legal.","James Bond: ""That's the part I like.""",,Do you have an eraser? Because I can't get you out of my mind.,"You remind me of Pokemon, I just want to Pikachu."
"Hey, did you used to be a demon? Cuz that's hot.","Marie: ""Is there something I can do for you?""",,Do you have any raisins? [No] How about a date?,You set my Chimchar on fire.
"Hey, girl, I’ve got some gossip for you. You sexy.","James Bond: ""As a matter of fact, there is. There's something I'd like you to get off your chest.""",,Do you have any sunscreen? 'Because you are burning me up!,You'll be WEEZING after I'm done with you.
"Hey, Hey, Hey, Hey! Let's go out sometimes.","May Day, where have you been? I've been waiting for you . . . to take care of me, personally.",,"Do you have the time? [Tells you the time] No, the time to write down my number?","You're such a good catch, i think i'll use my only MASTER BALL on you."
"Hey, Wanna take a trip to the special hell?",Mayday: Someone will take care of you.,,"Do you have the time? No, the time to write down my number?",You've got the lips of a Jynx!
"Hi, I'm Tom, I have a raccoon on my head.","James Bond: Oh! You'll see to that personally, will you?",,Do you know how I got these biceps? By lifting children out of poverty.,Your gonna need a HYPERPOTION by the time i'm done with you.
"Hi, my name is George, I'm unemployed and I live with my parents.","Miss Caruso: ""Such a delicate touch.""",,Do you know karate cause your body is kickin,Your more beautiful than a Beautifly.
"Hi, my name is Vod – Vod-Kaknockers!","Bond: ""Sheer magnetism, darling.""",,Do you know karate? Because your body is really kickin'.,Default dance repeatedly'
How about we head up to the bedroom for some halftime festivities?,"Miss Taro: ""What should I say to an invitation from a strange gentleman?""",,Do you know karate? Because your body's kickin!,Are you a Loot Pinata? Cause I can smack you all night long.
How about you let me put my Malcolm in your middle.,"James Bond: ""You should say yes.""",,"Do you know what I did last night? I looked up at the stars, and matched each one with a reason why I love you.",Are you an ATK? Because I want to get inside you
How you doing?,"Now put your clothes back on, and I'll buy you an ice cream.",,Do you know what my shirt is made of? Boyfriend material.,Are you purple save cause I’m checking you out.
Hurry up and write your number down before I don't want it no more,"Now put your clothes back on, and I'll buy you an ice cream.",,Do you know what'd look good on you? Me.,Call me cupid Cause I Just landed a crossbow shot to your heart.
I almost died choking on a donut! Alone!,"Oh, the things I do for England.",,Do you like short love affairs? I hate them - I've got all weekend.,Can i be your victory royale?
I always wear my special hat in bed,"Oh, the things I do for my country!",,"Do you live in a corn field, cause I'm stalking you.",Can I chug on your jugs?
I am a leaf on the wind... in bed,"Plenty O'Toole: ""Hi, I'm Plenty.""",,"Do you remember me? [No.] Oh that's right, we've only met in my dreams.",Can I explore your chest?
I am a love maker!,"James Bond: ""But of course you are.""",,Do you sleep on your stomach? No. Can I?,Can I hide in your bush?
I am a regular Harry Potter… In the kitchen of course.,"Roses are red, violets are blue, your pin number 6852.",,Do you want to see a picture of a beautiful person? (hold up a mirror),Can I see your chug jugs
I am filled with so much love for you my heart might explode.,"Russian Lady Agent: ""But James, I need you!""",,Do you work at Dick's? Because you're sporting the goods.,Come ride my big rocket and have a good time.
I am on a drug. It's called Charlie Sheen.,"Bond: ""So does England!""",,Do you work at Starbucks? Because I like you a latte.,Did you come from the lodge? Because I wouldn't make you lonely.
I blue myself when I think about you.,"Saida: ""Ah! I've lost my charm!""",,Do you work at subway? Because you just gave me a footlong!,Did you come from Tilted Towers? because I would Tilt you over!
"I can handle this. ""Handle"" is my middle name. Actually, ""handle"" is the middle of my first name.","James Bond: ""Not from where I'm standing.""",,Do you work for UPS? I could have sworn I saw you checking out my package.,"Do you play Fortnite, I want you in my fort tonight"
I don't have to be a medical professional to diagnose you with an extreme case of sexy.,Shocking. Positively shocking.,,Do you work for UPS? I could have sworn I saw you checking out my package.,Do you wanna see my tilted tower
I don't let anything get in the way of what I want. And I want you.,"Silva: ""There's a first time for everything — eh, Mr. Bond?""",,Do your legs hurt from running through my dreams all night?,Do you want to be lonely like lonely lodge or all action like tilted towers
I don't smoke...but I do flirt...,"James Bond: ""What makes you think it's my first time?""",,Does your father sell diamonds? Because you are FLAWLESS!,Fancy some pump action?
"I don't wanna blink, 'cause I'm afraid to miss even a second of your cuteness.","Sir Donald Munger: ""Tell me, Commander, how far does your expertise extend into the field of diamonds?""",,Does your left eye hurt? Because you've been looking right all day.,Get in my ATK.
"I don’t know about you, but I’m feeling pretty enlightened right now.","James Bond: ""Well, hardest substance found in nature, they cut glass, suggest marriages, I suppose it replaced the dog as the girl's best friend. That's about it.""",,Don’t you work at Hooters?,Girl are you a legendary?
I followed Hall & Oates around the country one summer,"Solitaire: ""Is there time before we leave for lesson number three?""",,"Even if there wasn't any gravity on earth, I would still fall for you!",Girl are you a Scar? You are Golden.
I have never met a pizza that I didn't like.,"James Bond: ""Of course. There's no sense going out half-cocked.""",,"Excuse me, but does this smell like chloroform to you?",Girl are you a supply drop? You are an angel that fell from the sky and saved me.
"I heard this place sells coffee. Maybe you and I could get one sometime, if you want.","Solitaire: ""James, what are you doing?""",,"Excuse me, but I think I dropped something. MY JAW!",Girl are you victory royal? You are my only one out of 100.
I hope your soul is permanent because I will give you more than one moment of true happiness,"James Bond: ""Just testing an old adage: 'Unlucky at cards . . . '""",,"Excuse me, but you dropped something back there"" (What?) ""This conversation, lets pick it up later tonight.","Hey babe, want me to grease up your grove tonight?"
I just hope my next fake girlfriend isn't so bossy,"Strawberry Fields: ""If you attempt to flee, I will arrest you, drop you off at the jail, and take you to the plane in chains, understand?""",,"Excuse me, could you please dial down your hotness, it's causing global warming",Hey girl wanna play doubles?
I just want to get my mother out of my head. I don't want to quit drinking or gambling or none of that good stuff.,"James Bond: ""Perfectly. After you.""",,"Excuse me, does this rag smell like chloroform to you?",How many bucks to see your V
I know your feet must be tired because you've been running through my mind all day!,"Mathis: ""I think she has handcuffs.""",,"Excuse me, I don't want you to think I'm ridiculous or anything, but you are the most beautiful woman I have ever seen. I just felt like I had to tell you.",I am no grappler but I could still reel you in.
I like hot girls. And I like hot boys. I like hot people. What can I say? I'm shallow.,"James Bond: ""I hope so.""",,"Excuse me, I just noticed you noticing me and I just wanted to give you notice that I noticed you too",I can explore your shifty with my clocktower.
"I like my women like I like my wine, red and full of alcohol.",Take a giant step for mankind.,,"Excuse me, I think you have something in your eye. Oh wait, it's just a sparkle.","I just survived Titled Towers, so I'm totally looted up right now."
I like the shape of your ears.,Tatiana Romanova: I think my mouth is too big!,,"Excuse me, I'd like to have kids someday, and I wanted to know how your parents created such a beautiful creature.",I love you by Default!
I like to listen to 90's R&B before trial.,"James Bond: It's just the right size... for me, that is.",,"Excuse me, I'm lost. Can you give me directions to your house?",I promise I ain't no double-pump chump.
I like to watch. Do you?,"Tell me, Miss Trench, do you play any other games?",,"Excuse me, if I go straight this way, will I be able to reach your heart?",I wanna jump in your rift and show you a whole new world.
I like your sweater…it's soft. - Piper,That's quite a nice little nothing you're almost wearing. I approve.,,"Excuse me. I'm from the FBI, the Fine Body Investigators, and I'm going to have to ask you to assume the position",I want my shifty shaft to visit your moisty mire 
I love you almost as much as I love television,The CIA is trying to steal my penis... I need to find a place to hide it.,,"Fascinating. I've been looking at your eyes all night long, 'cause I've never seen such dark eyes with so much light in them.",I want to land on you baby.
I may be a sick lesbian in a prison bunk. But I got a couple tricks up my sleeve.,The names Will. God's will.,,"For a moment I thought I had died and gone to heaven. Now I see that I am very much alive, and heaven has been brought to me.",I would drop my gold scar for you.
"I may shoot to kill, but I’d miss you.",Then how about a nightcap on the company? My company.,,"Forget about Spiderman, Superman, and Batman. I'll be your man.",I would love to harvest your materials.
"I might be going on a tangent, but would you like to be the Sine to my Cosine?","Vesper Lynd: ""I can't resist waking you. Every time I do, you look at me as if you hadn't seen me in years. Makes me feel reborn.""",,Girl you so fine I wish I could plant you and grow a whole field of y'all!,I’ll show you how to have fun in pleasant park
"I might be having feelings. Like weird, weird feelings for pretzels.","James Bond: ""If you had just been born, wouldn't you be naked?""",,"Girl you're like a car accident, cause I just can't look away.",I’m gonna take u to pleasant park and shove my shifty shaft inside your dusty depot.
I need your help to polish my gun.,"Vesper Lynd: ""If the only thing left of you was your smile and your little finger, you'd still be more of a man than anyone I've ever known.""",,"Girl, are you a cop? [No] Because you're America's Finest",I'd jump off a floating bus for you. 
"I noticed you noticing me, so I just wanted to put you on notice.. that I notice you too","James Bond: ""That's because you know what I can do with my little finger . . . """,,"Girl, if I were a fly, I'd be all over you, because you're the shit!","If we were the last 2 people on earth, I'd throw a boogie bomb down so we can dance together forever."
I provide leverage.,"Wai-Lin: ""They're looking for us, James.""",,Guess what I'm wearing? The smile you gave me.,"If you are a default, I will carry you all night long."
I see you're into anarchy. I'd love to get wild with you.,"James Bond: ""Let's stay under cover.""",,"Have you always been this cute, or did you have to work at it?","If you were a chest, I would loot you. "
"I swear by my pretty floral bonnet, I will do you.",We understand you so much better than the guy you're with now.,,Have you been to the doctor lately? Because I think you're lacking some Vitamin Me.,If your legs were a chest I'd open you right up
"I think I've seen your picture somewhere before... oh yeah that's right, it was in the dictionary next to KABLAM!","Well, I'm afraid you've caught me with more than my hands up",,Heaven's missing an Angel.,Ill be the meteor to your Tilted Towers
I think I’m falling in love with you.,What's a nice girl like you doing at the corner of 5th and Guadalupe avenue at 8:37pm?,,"Hello are you married? [Yes] Well I didn't hear you say ""happily"".",I'll make you wet like a shield potion if you go out with me.
I think my penis stopped breathing. Do you know CPR?,"Whatever I am...Whatever is left of me, I'm yours.",,"Hello how are you? [Fine] Hey, I didn't ask you how you looked!",Is your name Mire? Because I'm making you Moisty. 
I think we should go out on a real date.,"When one is in Egypt, one should delve deeply into its treasures.",,"Hello, I'm a thief, and I'm here to steal your heart.",Let's spend the night in my fort and have a pleasant time.
I think you're hot. And whoever doesn't like it can kiss my ass!,Would you...be interested in a night cap,,"Hello, I'm doing a survey of what people think are the cheesiest pickup lines. So, do you pick 'Do you come here often?', 'What's your sign?', or 'Hello, I'm doing a survey of what people think are the cheesiest pickup lines.'?",My health is low and I have no shield and no weapon. The only cure is for me to chug on those jugs of yours and for you to give me a little pump action.
I think you're totally ah-mah-zing!,"Xenia Onatopp: ""You don't need the gun, Commander.""",,Hello. Are you taking any applications for a boy/girlfriend?,My health is low and I have no shield and no weapon. The only cure is for me to chug on those jugs of yours.
